{
  "id": "OC_018_root_localization_source_package",
  "rank": 18,
  "proof_card": "proof.root.localization.v2",
  "mission": "Create a narrow root_localization source package that separates exact root-piece reconstruction from scalar architecture.",
  "allowed_source_keys": [
    "cmp116.localized-activity.2.7-2.10",
    "dimockii.fluctuation-covariance.271-276",
    "dimocki.lemma6.random-walk-green.84-85",
    "proof.root.localization.v2"
  ],
  "target_shape": "rootLocalization t k as a source-shaped proposition with support enlargement and rootWeight/root decay fields.",
  "minimal_success": [
    "exact proposition for rootLocalization or narrowed source blocker",
    "declares whether Dimock is architecture only",
    "support convention recorded"
  ],
  "reject_if": [
    "uses downstream H# or final Lemma 3 bound to prove an upstream field",
    "uses scalar Dimock architecture as a Yang-Mills theorem without a dictionary",
    "adds a monolithic raw-source package with the same live fields",
    "adds a downstream consumer while all old hypotheses remain"
  ],
  "expected_changed_paths": [
    "docs/source-db/catalogs/*.json",
    "docs/source-db/indices/*.md",
    "YangMills/RG/*.lean"
  ],
  "evidence_required": [
    "source locators",
    "support enlargement convention",
    "rootWeight constants",
    "dictionary status"
  ],
  "preferred_lean_targets": [
    "BalabanCMP116SourceAssumptions.root_localization"
  ],
  "prompt_file": "mission_prompts/OC_018_root_localization_source_package.es.md"
}
